{"schemaVersion":1,"id":"D1-TSUKIOKA-WAITING","screenUnit":"SCR-SVC-CUSTOMERS","profile":"complete-layer","sourceRevision":2,"runtimeBuild":1,"status":"passed","input":{"file":"../assets/d1-tsukioka-waiting-complete-fhd-r2.png","sha256":"0d825865988fab624c9153f4a1f453b12cea218809832bf3b0c10aec88669bc1"},"artifacts":[{"role":"primary","file":"../assets/d1-tsukioka-waiting-complete-fhd-r2.png","url":"/assets/core/customer/d1-tsukioka-waiting-r2-b1.png","sha256":"0d825865988fab624c9153f4a1f453b12cea218809832bf3b0c10aec88669bc1","bytes":340027,"format":"png","dimensions":{"width":1920,"height":1080}}],"lossPolicy":"lossless-required","visualRegression":{"result":"passed","method":"lossless passthrough: source and runtime artifact SHA-256 are identical","userApprovalRequired":false},"performanceBudget":{"result":"passed","checks":["single PNG artifact","no dimension growth","no byte growth"]}}
