{"schemaVersion":1,"id":"ST-DRINK-BEER-TIER-1","screenUnit":"SCR-SVC-DRINK","profile":"standalone-raster","sourceRevision":4,"runtimeBuild":1,"status":"passed","input":{"file":"../assets/st-drink-beer-tier-1-r4.png","sha256":"a0bd01f55f893520d48b8e38bccdb18c90868c228f6a7336eab43f162d0f6ed1"},"artifacts":[{"role":"primary","file":"../assets/st-drink-beer-tier-1-r4.png","url":"/assets/core/drink/st-drink-beer-tier-1-r4-b1.png","sha256":"a0bd01f55f893520d48b8e38bccdb18c90868c228f6a7336eab43f162d0f6ed1","bytes":243511,"format":"png","dimensions":{"width":1920,"height":1080}}],"lossPolicy":"lossless-required","visualRegression":{"result":"passed","method":"lossless passthrough: approved source and runtime artifact SHA-256 are identical","userApprovalRequired":false},"performanceBudget":{"result":"passed","checks":["single PNG artifact","no dimension growth","no byte growth"]}}
