{
  "schemaVersion": 1,
  "id": "PR-SHOP-KEY",
  "screenUnit": "SCR-STORY-PROLOGUE:S0-STATE-KEY",
  "profile": "standalone-raster",
  "sourceRevision": 1,
  "runtimeBuild": 1,
  "status": "passed",
  "input": {
    "file": "../assets/pr-shop-key-placed-r1.png",
    "sha256": "a8a22c3beaa6a4ffa1b45dad6eb4438eda729d325740ad9bcb265d3363229eeb"
  },
  "artifacts": [
    {
      "role": "primary",
      "file": "../assets/pr-shop-key-placed-r1.png",
      "url": "/assets/core/s0/prologue/pr-shop-key-placed-r1-b1.png",
      "sha256": "a8a22c3beaa6a4ffa1b45dad6eb4438eda729d325740ad9bcb265d3363229eeb",
      "bytes": 268103,
      "format": "png",
      "dimensions": { "width": 1254, "height": 1254 }
    }
  ],
  "lossPolicy": "lossless-required",
  "visualRegression": {
    "result": "passed",
    "method": "lossless passthrough: approved source and runtime primary artifact SHA-256 are identical",
    "userApprovalRequired": false
  },
  "performanceBudget": {
    "result": "passed",
    "checks": ["single approved straight-alpha PNG", "no pixel transform", "no dimension change", "no byte growth"]
  }
}
