{"schemaVersion":1,"id":"UI-CUSTOMER-ORDER-WAIT-PANEL","screenUnit":"SCR-SVC-CUSTOMERS","profile":"standalone-raster","sourceRevision":3,"runtimeBuild":1,"status":"passed","input":{"file":"../assets/customer-order-wait-panel-skin-r3.png","sha256":"3be12bd990151327e41070734ea6b78a8c8c0942d0bd44e65a12be4c75bf5e47"},"artifacts":[{"role":"primary","file":"../assets/customer-order-wait-panel-skin-r3.png","url":"/assets/core/ui/customer-order-wait-panel-skin-r3-b1.png","sha256":"3be12bd990151327e41070734ea6b78a8c8c0942d0bd44e65a12be4c75bf5e47","bytes":50683,"format":"png","dimensions":{"width":232,"height":174}}],"lossPolicy":"lossless-required","visualRegression":{"result":"passed","method":"lossless passthrough: source and runtime artifact SHA-256 are identical","userApprovalRequired":false},"performanceBudget":{"result":"passed","checks":["single PNG artifact","no dimension growth","no byte growth"]}}
