{"schemaVersion":1,"id":"BG-SERVICE-TABLE-ARTIST009","screenUnit":"SCR-SVC-CUSTOMERS","profile":"complete-layer","sourceRevision":1,"runtimeBuild":1,"status":"passed","input":{"file":"../assets/service-table-complete-fhd-r1.png","sha256":"64ed1bb62a5d25100d2a64c040872f172476ea34833170f811c9bfe3aad2ed7c"},"artifacts":[{"role":"primary","file":"../assets/service-table-complete-fhd-r1.png","url":"/assets/core/customer/service-table-complete-r1-b1.png","sha256":"64ed1bb62a5d25100d2a64c040872f172476ea34833170f811c9bfe3aad2ed7c","bytes":1425229,"format":"png","dimensions":{"width":1920,"height":1080}}],"lossPolicy":"lossless-required","visualRegression":{"result":"passed","method":"lossless passthrough: source and runtime artifact SHA-256 are identical","userApprovalRequired":false},"performanceBudget":{"result":"passed","checks":["single PNG artifact","no dimension growth","no byte growth"]}}
