{
  "schemaVersion": 1,
  "id": "MDL-INGREDIENT-NEGI",
  "screenUnit": "SCR-SVC-ASSEMBLY",
  "profile": "bundle-model",
  "sourceRevision": 3,
  "runtimeBuild": 1,
  "status": "passed",
  "input": {
    "file": "../assets/mdl-ingredient-negi-r3.glb",
    "sha256": "065a918355c625f4c2f364d26dc0e20b3326155c799399905c04aa48494bb3e3"
  },
  "artifacts": [
    {
      "role": "primary",
      "file": "../assets/mdl-ingredient-negi-r3.glb",
      "url": "/assets/core/cooking/mdl-ingredient-negi-r3-b1.glb",
      "sha256": "065a918355c625f4c2f364d26dc0e20b3326155c799399905c04aa48494bb3e3",
      "bytes": 5112,
      "format": "glb"
    },
    {
      "role": "pixel-albedo",
      "file": "../assets/tex-ingredient-negi-albedo-r3.png",
      "url": "/assets/core/cooking/mdl-ingredient-negi-pixel-albedo-r3-b1.png",
      "sha256": "8712631509a5477d81ab88b6e99dd62ae803225560667cd60ec8d18fe131aa95",
      "bytes": 55025,
      "format": "png",
      "dimensions": {
        "width": 256,
        "height": 192
      }
    }
  ],
  "lossPolicy": "lossless-required",
  "visualRegression": {
    "result": "passed",
    "method": "lossless-identity: 승인 provenance.output과 runtime primary 산출물이 동일한 SHA-256·byte이며 재인코딩·리샘플·메타데이터 편집이 없다",
    "userApprovalRequired": false
  },
  "performanceBudget": {
    "result": "passed",
    "checks": [
      "단일 primary runtime payload (5112 bytes, glb)",
      "byte·픽셀·지오메트리·치수 변화 없음 (lossless-identity)",
      "1개 승인 companion을 재인코딩 없이 재참조"
    ]
  }
}
