{
  "schemaVersion": 1,
  "id": "BG-INTERIOR-BASE",
  "screenUnit": "SCR-SVC-CUSTOMERS",
  "profile": "standalone-raster",
  "sourceRevision": 1,
  "runtimeBuild": 1,
  "status": "passed",
  "input": {
    "file": "../assets/bg-interior-base-fhd-r1.png",
    "sha256": "5f176702b5fa2222fe08e7c5349b1c436a68319cdadfff02dd44d9f342a7baee"
  },
  "artifacts": [
    {
      "role": "primary",
      "file": "../assets/bg-interior-base-fhd-r1.png",
      "url": "/assets/core/customer/bg-interior-base-r1-b1.png",
      "sha256": "5f176702b5fa2222fe08e7c5349b1c436a68319cdadfff02dd44d9f342a7baee",
      "bytes": 3111275,
      "format": "png",
      "dimensions": {
        "width": 1920,
        "height": 1080
      }
    }
  ],
  "lossPolicy": "lossless-required",
  "visualRegression": {
    "result": "passed",
    "method": "lossless-identity: 승인 provenance.output과 runtime primary 산출물이 동일한 SHA-256·byte이며 재인코딩·리샘플·메타데이터 편집이 없다",
    "userApprovalRequired": false
  },
  "performanceBudget": {
    "result": "passed",
    "checks": [
      "단일 primary runtime payload (3111275 bytes, png)",
      "byte·픽셀·지오메트리·치수 변화 없음 (lossless-identity)",
      "companion 없음"
    ]
  }
}
