{"schemaVersion":1,"id":"D1-TSUKIOKA-PARTIAL-BEER-WAITING","screenUnit":"SCR-SVC-CUSTOMERS","profile":"complete-layer","sourceRevision":1,"runtimeBuild":1,"status":"passed","input":{"file":"../assets/d1-tsukioka-partial-beer-waiting-complete-fhd-r1.png","sha256":"5fa4f5e257d54838aa22fe1403426808b71cd7bd9526730e666ea811ad5b1501"},"artifacts":[{"role":"primary","file":"../assets/d1-tsukioka-partial-beer-waiting-complete-fhd-r1.png","url":"/assets/core/customer/d1-tsukioka-partial-beer-waiting-r1-b1.png","sha256":"5fa4f5e257d54838aa22fe1403426808b71cd7bd9526730e666ea811ad5b1501","bytes":341658,"format":"png","dimensions":{"width":1920,"height":1080}}],"lossPolicy":"lossless-required","visualRegression":{"result":"passed","method":"lossless passthrough: source and runtime artifact SHA-256 are identical","userApprovalRequired":false},"performanceBudget":{"result":"passed","checks":["single PNG artifact","no dimension growth","no byte growth"]}}
